{
  "schemaVersion": "1.0.0",
  "productId": "11111111-1111-4111-8111-111111111111",
  "sku": "DEMO-SERUM-001",
  "name": "Fictional Test Serum",
  "category": "skincare",
  "rightsAcknowledged": true,
  "facts": [
    {
      "factId": "22222222-2222-4222-8222-222222222222",
      "name": "product_type",
      "value": "bottle",
      "origin": "USER_CONFIRMED",
      "confirmed": true,
      "sourceAssetId": "33333333-3333-4333-8333-333333333333"
    }
  ],
  "sourceAssets": [
    {
      "assetId": "33333333-3333-4333-8333-333333333333",
      "sha256": "aaaaaaaaaaaaaaaaaaaaaaaaaaaaaaaaaaaaaaaaaaaaaaaaaaaaaaaaaaaaaaaa",
      "mimeType": "image/png",
      "width": 1024,
      "height": 1024,
      "cameraView": "FRONT",
      "filename": "synthetic-source.png"
    }
  ],
  "brandLock": {
    "mode": "STRICT",
    "protectedText": [
      "DEMO"
    ],
    "forbiddenChanges": [
      "do not change visible logo or label"
    ],
    "maskAssetId": "44444444-4444-4444-8444-444444444444",
    "lockedColors": [
      "#AA7744"
    ]
  },
  "createdAt": "2026-10-29T12:00:00Z",
  "updatedAt": "2026-10-29T12:00:00Z"
}
